{
  "document_type": "aset-component-bounded-model-check-results",
  "method": "BOUNDED_EXHAUSTIVE_PYTHON_PROJECTION",
  "models": [
    {
      "failures": [],
      "id": "context",
      "invariants": [
        "PatchRequiresExactSource",
        "OneCrossing"
      ],
      "states": 7,
      "transitions": 6,
      "verdict": "PASS"
    },
    {
      "failures": [],
      "id": "core",
      "invariants": [
        "DecisionBeforePermit",
        "PermitAtMostOnce"
      ],
      "states": 4,
      "transitions": 3,
      "verdict": "PASS"
    },
    {
      "failures": [],
      "id": "gateway",
      "invariants": [
        "ContextUnchanged",
        "NoToolEffect"
      ],
      "states": 2,
      "transitions": 1,
      "verdict": "PASS"
    },
    {
      "failures": [],
      "id": "master",
      "invariants": [
        "AdvisoryOnly",
        "NoSelfAuthorization"
      ],
      "states": 2,
      "transitions": 1,
      "verdict": "PASS"
    },
    {
      "failures": [],
      "id": "memory",
      "invariants": [
        "RetrievalNotVerification",
        "MutationAuthorized"
      ],
      "states": 6,
      "transitions": 7,
      "verdict": "PASS"
    },
    {
      "failures": [],
      "id": "monade",
      "invariants": [
        "IntentBeforeObservation",
        "OutcomeVerified"
      ],
      "states": 6,
      "transitions": 5,
      "verdict": "PASS"
    },
    {
      "failures": [],
      "id": "protocol",
      "invariants": [
        "SchemaBeforeAdmission",
        "NoBusinessAuthority"
      ],
      "states": 4,
      "transitions": 3,
      "verdict": "PASS"
    },
    {
      "failures": [],
      "id": "system-composition",
      "invariants": [
        "SeparatePermits",
        "OutcomeRequiresVerification"
      ],
      "states": 7,
      "transitions": 6,
      "verdict": "PASS"
    }
  ],
  "models_failed": 0,
  "models_passed": 8,
  "models_total": 8,
  "profile": "0.1-rc1",
  "schema_version": 1,
  "verdict": "PASS"
}
